"Retailer","Alamat","Area","Telepon","Fax"
"HPM Cibubur","CIBUBUR JUNCTION Jl.Jambore RT. 004/014, Kel CibuburKec Ciracas, Jakarta Timur","021","87756345/87756344","87756345"
"HPM Sentul","Belanova Sentul Jl. MH. Thamrin Sentul","021","87923799/87923873/87923867","87923873"
"HPM Pondok Gede","Plaza Pondok Gede 2 Jl Raya Pondok Gede No.1 Bekasi","021","84938420/84938444","84938421"
"HPM Karawaci","SUPERMALL KARAWACI Jl. Bulevar Diponegoro 105 Lippo Karawaci 1200","021","54212047/54212066","5472530/5472267"
"HPM Bekasi","GRAND MALL BEKASI Jl. Jend. Sudirman No. 01 Kranji - Bekasi Barat 17135","021","88966334/88966335/88966345","88954852"
"HPM Cikarang","Mall Lippo Cikarang Jl. M. Husni Thamrin Lippo City, Cikarang, Bekasi","021","89901110/89901578/89901423/899009","89901112"
"HPM Serpong","MALL WTC MATAHARI SERPONG Jl. Raya Serpong No. 39 Tangerang 15326","021","53154753/5315457","53154762/53154792"
"HPM Gajah Mada","GAJAH MADA PLAZA Jl. Gajahmada No. 19-26 Jakarta Pusat","021","6343463/6338825/6343954","6343854"
"HPM KTC","KTC Jl. Bulevard Barat Raya Jakarta Utara","021"," 45851294/45851297/45851295","45851293"
"HPM Depok","Depok Town Square Jl. Margonda Raya No. 1 Pondok Cina Beji, Depok 16424","021","78870263/78870288","78893065"
"HPM Jacc","JaCC Plaza Jl. Kebon Kacang Raya, Waduk Melati Tanah Abang - Jakarta Pusat","021","31991010/31991014/31991003","31991011"
"HPM Pejaten"," Pejaten Village Mall Jl. Warung Jati Barat No. 39 Pejaten Village, Jakarta Selatan","021","7821677",""
"HPM Metropolis","METROPOLIS TOWN SQUARE Jl. Hartono Raya Moderen 1 No.17 Kelapa Indah - Kota Modern Tangerang","021","55780979/55780988","55780975"
"HPM Daan Mogot","MALL MATAHARI DAAN MOGOT Jl. Raya Daan Mogot Km 16.5 Kali Deres, Cengkareng Jakarta Barat","021","54377755/54377756/54391218/543821","54377755"
"HPM MGK","Mega Glodok Kemayoran Jl. Angkasa Kav.B 6 Jakarta","021","65701576/26647455/65701573","6570157"
"HPM Puri Indah","PARAGON MALL PURI Jl. Puri Indah Raya Blok W, Rt. 01/ Rw. 02 Kel: Kembangan Selatan, Kec Kembangan Jakarta Barat ( Samping Walikota Jakbar )","021","58357420/58357421","58357422"
"HPM Cyberpark Lippo Vilage","Lippo Karawaci Utara Jl. Falatehan (Depan Ruko Pinangsia) Lippo Karawaci Utara Tangerang","","",""
"HPM Kemang Village","Kemang Village Jl. Kemang 6 / Jl. P. Antasari No.36 Kemang, Jakarta Selatan Kel. Bangka, Kec. Mampang Prapatan","","",""
"HPM Gading Serpong","Gading Serpong Jl. Bulevard Gading Golf M5/2 Kel. Pakulonan Barat, Kec. Kelapa Dua Tangerang","","",""
"HPM Tangerang","Mall Bale Kota Jl. Jend. Sudirman KM 10 Kel. Buaran Indah, Kec. Tanah Tinggi Tangerang 15119","","",""
"HPM Cimanggis","HPM Cimanggis Square Jl. Raya Bogor KM 29 Kel. Mekarsari, Kec. Cimanggis Depok (sebelah RS Tugu Ibu)","","",""
"HPM Cibubur"," HPM Mal Citragrand Jl. Transyogi Cibubur Kel. Jatikarya, Kec. Jatisampurna Bekasi","","",""
"HPM Cilegon","Hypermart Mayofild Cilegon (327) Jl SA Tirtayasa Simpang Tiga Cilegon","0254","389696","390630"
"HPM BIP Bandung","BIP Plaza Jl. Merdeka No.56, Bandung","022","4223290 4223291 4241653","4233913 4213597 4241653"
"HPM MTC","Metro Trade Centre Jl. Soekarno Hatta 590 Bandung - Jawa Barat","022","7538410 7538411 7538438","7538438 7537631"
"HPM MIKO BANDUNG","Miko Mall Jl. Kopo Cirangrang No.599 Bandung - Jawa Barat","022","85446221","-"
"HPM Cianjur","HPM Mayofield Cianjur Jl. Abdullah Bin Nooh No.1, Cianjur","0263","262432 262434 261963","-"
"HPM SERANG","HPM SERANG Jl. Kemang Kaligandu Kel. Penancangan, Kec. Cipocok Serang - Banten","-","-","-"
"HPM CIREBON","HPM CIREBON SUPER BLOK Jl. Dr. Cipto Mangunkusumo No. 26 Cirebon","-","-","-"
"HPM Solo","SOLO GRAND MALL Jl. Slamet Riyadi No. 273, Solo","0271","741891 / 92 741669 741923","741890"
"HPM Solo Square","SOLO SQUARE Jl. Slamet Riyadi No. 451 Kel Pajang, Kec Lawean, Surakarta - Solo","0271","7651769 7651766 7651767","7651768"
"HPM Java Mall","JAVA MALL Jl. MT. Haryono No. 992-994 Semarang","024","8410404","8410206"
"HPM Paragon Semarang","Mall Paragon Semarang Jl. Pemuda No 118 Semarang (Depan Hotel Novotel) Semarang - Jawa Tengah","024","86579044","-"
"HPM Pekalongan","Plaza Pekalongan Jl. Nusantara No. 5 Pekalongan","0285","434284","-"
"HPM KUDUS","HPM KUDUS JL. Lukmono Hadi No.1 Kudus","-","-","-"
"HPM SOLO","HPM Hartono Mall Solo Jl. Raya Solo Baru Ds. Madegondo, Grogol - Sukoharjo","-","-","-"
"HPM TEGAL","HPM Pacific Mall Tegal Jl. Mayjen Sutoyo, Tegal, Jawa Tengah","-","-","-"
"HPM Madiun","Plaza Madiun Jl Pahlawan No. 38 - 40, Madiun","0351","482340 499055","499055"
"HPM Malang","MALANG TOWN SQUARE UG Level Jl. Veteran No.2 Klojen Malang 65114","0341","559055 559056 559053","557871 559044"
"HPM Pakuwon","Pakuwon Trade Centre (PTC) Jl. Puncak Indah Lontar No. 2 Surabaya 60123","031","7390222 7390271","7390251"
"HPM Royal","Royal Surabaya Jl. Ahmad Yani No. 16 - 18 Surabaya - Jawa Timur","031","8271250 8271237 / 38 8271239","8271239 8271252"
"HPM Cito","CITY OF TOMORROW Jl. Ahmad Yani No. 288 Lt. LG Waru, Sidoarjo","031","58251234 58251235 58251168","58251169"
"HPM EastCoast Center","Jl. Kejawen Putih Tambak Pakuwon City Surabaya","-","-","-"
"HPM CIPUTRA WORLD","HPM Ciputra World Jl. Mayjen Sungkono No 89 Depan TVRI, Surabaya","-","-","-"
"HPM GRESIK","HPM GRESIK Jl. Veteran Kel. Sidomoro, Kec. Kebo Mas Gresik - Jawa Timur","-","-","-"
"HPM KEDIRI","HPM SRI RATU KEDIRI Jl. Hasanuddin No 1-3, Kel. Balowerti, Kec. Kota Kediri - Jawa Timur","-","-","-"
"HPM BATU MALANG","HPM BATU TOWN SQUARE Jl. Diponegoro No.1, Batu","-","-","-"
"HPM SIDOARJO","HPM SIDOARJO TOWN SQUARE Jl. Raya Jati No.1 (Exit Tol Sidoarjo Sidoarjo, Jawa Timur","-","-","-"